Country,Plan name,Strategic priority code,Strategic priority,Outcome code,Outcome,Output code,Output,Sub-Output publication status,Sub-Output code,Sub-Output,ID,Description,Start date,End date,Status,Joint Programmes / Initiatives names,Joint Programmes / Initiatives types,Agency abbreviations,Agencies,Contributing partners,Implementation partners,SDG Targets,SDG Goals,Geography,QCPR function,Humanitarian marker,Humanitarian marker narrative,Gender marker,Gender marker narrative,Human rights marker,Suboutput also contributes to the following outputs,Human rights marker narrative,Sustaining peace marker,Sustaining peace marker narrative,LNOB groups targeted,Focal users,Non Monetary Assistance,Total required resources,Total available resources,Total expenditure resources,2015 Required,2015 Available,2015 Expenditure,2015 Narrative,2017 Required,2017 Available,2017 Expenditure,2017 Narrative,2018 Required,2018 Available,2018 Expenditure,2018 Narrative,2019 Required,2019 Available,2019 Expenditure,2019 Narrative,2020 Required,2020 Available,2020 Expenditure,2020 Narrative,2021 Required,2021 Available,2021 Expenditure,2021 Narrative,2022 Required,2022 Available,2022 Expenditure,2022 Narrative,2023 Required,2023 Available,2023 Expenditure,2023 Narrative,2024 Required,2024 Available,2024 Expenditure,2024 Narrative,2025 Required,2025 Available,2025 Expenditure,2025 Narrative,2026 Required,2026 Available,2026 Expenditure,2026 Narrative,2027 Required,2027 Available,2027 Expenditure,2027 Narrative
Dominican Republic,United Nations Sustainable Development Cooperation Framework,1,IGUALDAD E INCLUSIÓN SOCIAL,2.0,"Bienes y servicios sociales de calidad, universales, inclusivos y resilientes",2.2,"2.2 Mejoradas las políticas y los servicios de educación de calidad, incluidas la educación en materia de derechos humanos, educación sexual integral, educación alimentaria y nutricional, educación ambiental y desarrollo integral de la primera infancia",Yes, 00-2024 UNESCO,National Initiative on Education for Sustainable Development  for 2030 - Dominican Republic ,151683,"With the support of the Japanese Funds-in-Trust, UNESCO, in response to a request for technical assistance from the Ministry of Environment and Natural Resources of the Dominican Republic, implemented the national assessment on ESD. 

Output: Country initiatives designed for implementation by Member States through increased capacities of the education systems and individuals in support of sustainability:

Activities in the Dominican Republic: Develop an overview of the legal and policy context in which ESD is delivered, including laws, policies, regulations, education sector guidelines and standards, environment regulations, and other areas studied by Evaluation of the National Initiative; analyze, based on the Evaluation of the National Initiative on ESD interviews, the materials reviewed in terms of the needs of the education sector, with a particular focus on Priority areas of ESD action for 2030, and identify GAPS and make recommendations to ensure the National Initiative on ESD.
",2023-12-15,2024-01-17,Closed,-,-,UNESCO,"United Nations Educational, Scientific and Cultural Organisation",Government of Japan,"United Nations Educational, Scientific and Cultural Organisation","4.7 By 2030, ensure that all learners acquire the knowledge and skills needed to promote sustainable development, including, among others, through education for sustainable development and sustainable lifestyles, human rights, gender equality, promotion of a culture of peace and nonviolence, global citizenship and appreciation of cultural diversity and of culture's contribution to sustainable development.",4 Quality Education,Dominican Republic,Data Collection and Analysis; Capacity Development/Technical Assistance,-,-,2 - Gender equality/women's empowerment is a significant objective,,2 - Significant contribution to realization of human rights,-,,-,-,Other,Franklin  Tejeda,,4600,4600,4600.0,2300.0,1628.45,1199.17,-,2300.0,1881.78,1404.91,-,2300.0,1955.1,1392.2,-,2300.0,1926.8,1513.07,-,2300.0,1765.05,1461.97,-,2300.0,1639.41,1283.59,-,2300.0,2094.49,1850.48,-,2000.0,1557.98,1249.38,-,2600.0,2053.57,1386.18,"An initiative to devise a National Education Strategy for Sustainable Development has been launched in the Dominican Republic. The strategy seeks to reveal the challenges, opportunities and the roadmap to follow in terms of sustainability in order to align efforts in the conception of sustainable economic development, environmental conservation and social equity.",2300.0,1775.48,1556.45,-,,,,-,,,,-
Brazil,United Nations Development Assistance Framework,4,"Peace: A peaceful, fair, and inclusive society",1.0,"Outcome 6: A peaceful, fair and inclusive society promoted through social participation, transparency and democratic governance, respecting the secularity of the State and ensuring human rights for all",9,"6.1 Legislation, public policies and institutional capacities strengthened and aligned with international human rights standards to protect, prevent and respond to violence, crime, exploitation, neglect and discrimination, including against groups in situations of greater vulnerability or emergency, considering gender, race, ethnicity, origin, nationality and age, ensuring democratic and transparent governance with broad social participation and access to justice",Yes,12,UNOPS 21588 Implementation of Social-educational Infrastructure with the Ministry of Human Rights,70141,The project aims to strengthen the capacity of the Ministry of Human Rights by jointly designing and building 3 social-educational centers for youth offenders and operation and maintenance plans.,2021-01-01,2022-08-15,Implementation,-,-,UNOPS,United Nations Office for Project Services,Brazilian Ministry of Women,-,"16.a Strengthen relevant national institutions, including through international cooperation, for building capacity at all levels, in particular in developing countries, to prevent violence and combat terrorism and crime.",16 Peace and Justice - Strong Institutions,Brazil,Capacity Development/Technical Assistance; Direct Support/ Service Delivery,-,-,1 - Contributes to gender equality/women's empowerment in a limited way,-,1 - Limited contribution to realization of human rights,-,-,0 - Not expected to contribute towards sustaining peace,-,-,Pedro Fontoura,,631303,631303,631303.0,315651.5,226651.84,166761.69,-,315651.5,259688.24,222272.53,-,315651.5,242301.28,166422.38,-,315651.5,208879.02,141636.99,-,315651.5,290606.7,232481.41,-,228423.0,168603.7,114369.91,"In 2021 the project developed a study on investment parameters for social-educational infrastructure for youth offenders and architectural and engineering designs for 3 new social-educational centers. These results will enable youth to serve social-educational measures in higher quality spaces and closer to their families, improving the effectiveness of the social-educational system and promoting human rights.",402880.0,294204.22,230076.84,"In 2022, the project developed a study on female socio-educational infrastructure to identify the greatest investment needs. It also developed detailed designs for two male social-educational centers for youth offenders, incorporating sustainability, economy and humanization of environments. Documentation was prepared for the bidding of these works in 2023.",315651.5,241683.57,216570.01,-,315651.5,254348.03,201627.57,-,315651.5,239050.93,176450.69,-,,,,-,,,,-
Dominican Republic,United Nations Sustainable Development Cooperation Framework,1,IGUALDAD E INCLUSIÓN SOCIAL,2.0,"Bienes y servicios sociales de calidad, universales, inclusivos y resilientes",2.2,"2.2 Mejoradas las políticas y los servicios de educación de calidad, incluidas la educación en materia de derechos humanos, educación sexual integral, educación alimentaria y nutricional, educación ambiental y desarrollo integral de la primera infancia",Yes, 05-2024 UNESCO,Led study on Transformative Education Approaches (“Educacion en colores”) ,179208,"Led study on Transformative Education approaches (Educacion en colores”) that are part of the Recommendation for Human Rights, Fundamental Freedoms, and Sustainable Development for its operationalization at the school level (this included a mapping of 118 transformative practices in Cuba, Venezuela, and Dominican Republic) .",2025-01-01,2025-05-31,Implementation,-,-,UNESCO,"United Nations Educational, Scientific and Cultural Organisation",UNESCO Regular Programme,Ministerio de Educación de la República Dominicana; UNESCO Associated Schools Network,"4.7 By 2030, ensure that all learners acquire the knowledge and skills needed to promote sustainable development, including, among others, through education for sustainable development and sustainable lifestyles, human rights, gender equality, promotion of a culture of peace and nonviolence, global citizenship and appreciation of cultural diversity and of culture's contribution to sustainable development.",4 Quality Education,Dominican Republic,Data Collection and Analysis,-,-,2 - Gender equality/women's empowerment is a significant objective,,2 - Significant contribution to realization of human rights,"2.2 2.2 Mejoradas las políticas y los servicios de educación de calidad, incluidas la educación en materia de derechos humanos, educación sexual integral, educación alimentaria y nutricional, educación ambiental y desarrollo integral de la primera infancia",,-,-,-,Franklin  Tejeda,,3000,0,0.0,3000.0,2850.0,2088.81,-,3000.0,2598.92,1977.13,-,3000.0,2395.9,1901.83,-,3000.0,2599.05,2051.04,-,3000.0,2210.29,1578.65,-,3000.0,2079.2,1778.66,-,3000.0,2678.36,2271.34,-,3000.0,2299.87,1775.24,-,3000.0,2615.04,2148.61,-,3000.0,2162.89,1802.04,-,,,,-,,,,-
the Caribbean,United Nations Sustainable Development Cooperation Framework,2,"Equality, Well-Being and Leaving No One Behind",4.0,"People in the Caribbean equitably access and utilize universal, quality and shock-responsive, social protection, education, health, and care services",77,"BZE 4.3 By 2024, access to comprehensive education and quality learning opportunities increased for  poor and socially marginalized (LNOB) populations [including for out-of-school children, and in emergency settings] ",Yes,1,"BZE 4.3.1:Teacher capacity strengthened in digital pedagogies and ICTS to support student learning and assessment in blended and online modalities, with focus on populations significantly displaced by distance education.",91110,-,2022-01-01,2023-12-31,Pipeline,-,-,UNESCO,"United Nations Educational, Scientific and Cultural Organisation",UNESCO Regular Programme,"Belize Ministry of Education, Culture, Science & Technology, E-Governance; UNESCO National Commission in Belize","4.6 By 2030, ensure that all youth and a substantial proportion of adults, both men and women, and achieve literacy and numeracy.,4.c By 2030, substantially increase the supply of qualified teachers, including through international cooperation for teacher training in developing countries, especially least developed countries and small island developing States.",4 Quality Education,Belize,-,-,-,0 - Not expected to contribute to gender equality/women's empowerment,,0 - Not expected to contribute to realization of human rights,-,,-,-,-,-,In Kind,0,0,0.0,,,,-,,,,-,,,,-,,,,-,,,,-,,,,-,381054.65,295058.05,248664.53,-,296118.31,218037.85,163446.79,-,338586.48,230681.05,204690.99,-,338586.48,213449.21,173562.75,-,,,,-,,,,-
El Salvador,United Nations Sustainable Development Cooperation Framework,3,"PE3 Paz sostenible, inclusiva e igualitaria para el ejercicio de la  democracia y el goce de una sociedad más segura y justa",1.0,"E6 Al 2026, las instituciones salvadoreñas fortalecen la  gobernabilidad democrática garantizando el Estado de  Derecho y la participación política y cívica inclusiva, así  como la prevención y combate de la corrupción, fomentando  la transparencia y la rendición de cuentas.",26,"E6P4 Instituciones públicas, la sociedad civil, el sector privado, y la población en situación de  vulnerabilidad, cuentan con habilidades y capacidades fortalecidas, mecanismos, espacios de  participación cívicos y políticos, y procesos electorales, para la incidencia y toma de decisiones  políticas, económicas, sociales y culturales, en particular en las agendas de paz y gobernabilidad.",Yes,1,Citizenship 2.0 Civic education to increase citizen participation in public decision making-128565,67996,"The project will work with the Supreme Electoral Tribunal and civil society organizations to promote citizen participation through capacity building for the exercise of political rights and the elimination of political violence, with emphasis on youth, women, people with disabilities and LGBTI people. Likewise, civic education processes will be promoted for citizens in general, with emphasis on young people and, especially, for those who may participate in the electoral processes as part of the Voting Boards. The two areas of work to be developed will be: a) Work with political parties and CSOs on political violence for its prevention and control; b) Development of virtual/interactive courses on the political system and the role of the electoral bodies, with emphasis on young people.",2022-01-01,2023-12-31,Closed,-,-,UNDP,United Nations Development Programme,Government of the Netherlands; United Nations Development Programme,El Salvador Tribunal Supremo Electoral,16.8 Broaden and strengthen the participation of developing countries in the institutions of global governance.,16 Peace and Justice - Strong Institutions,El Salvador,Capacity Development/Technical Assistance,-,-,2 - Gender equality/women's empowerment is a significant objective,,2 - Significant contribution to realization of human rights,-,,0 - Not expected to contribute towards sustaining peace,,Women & Girls; LGBTI persons (sexual orientation and gender identity); Persons With Disabilities; Youth,-,,198368,248998,149565.0,99184.0,75138.51,53461.13,-,99184.0,71742.99,61923.96,-,99184.0,84163.02,65368.73,-,99184.0,83829.37,68052.9,-,99184.0,82513.74,66695.82,-,99184.0,71120.1,53264.62,-,96433.0,73513.75,58257.59,"Con insumos de las instituciones nacionales de los tres órganos de Estado y municipalidades y liderados por el tribunal electoral, ONU Mujeres y el PNUD en alianza con IDEA Internacional, presentaron el estudio de “participación política igualitaria, una contribución al desarrollo sostenible”. El estudio busca hacer visible la situación de las mujeres en la administración pública, y que sea utilizado como una herramienta para la toma de decisiones inclusivas e igualitarias. Consta de 40 indicadores y 8 dimensiones que fueron utilizados para identificar los avances y desafíos de la participacion política de las mujeres en El Salvador.La sociedad civil a través de la Red para una Democracia Paritaria -la red es un colectivo compuesto por diversidad de instituciones, con diferentes naturalezas, orígenes, regulaciones, etc. Pero con un propósito común- se entregó al Tribunal electoral y al Instituto de Desarrollo de la mujer una “Propuesta de Protocolo de atención a víctimas de violencia política”, para que el TSE tenga insumos para reglamentar la nueva obligación legal de elaborar un protocolo de atención para las mujeres víctimas de violencia, recopilar información de ese tipo de casos e incorporar en todos los programas de formación y capacitación del Tribunal contenidos para prevenir y erradicar violencia contra mujeres que participan en la vida política electoral"".",101935.0,77904.53,55607.16,"A partir del informe de la Misión de Evaluación de Necesidades (NAM) se contribuyó al fortalecimiento institucional del Tribunal Supremo Electoral para la educación cívica, la modernización de sus sistemas de gestión y la atención de la violencia electoral contra las mujeres. El PNUD facilitó una herramienta para monitorear el progreso del calendario electoral y las decisiones del Organismo colegiado; actualizó el aula virtual de formación electoral y se elaboró y publicó el ""primer protocolo de atención para mujeres víctimas de violencia"".",99184.0,89308.28,69452.34,-,99184.0,91794.51,65305.15,-,,,,-,,,,-
the Caribbean,2017-2021 MSDF,3,"Strategic Priority 3 - A Safe, Cohesive, and Just Caribbean",1.0,Outcome 3.1 - Capacities of public policy and rule of law institutions and civil society organisations strengthened.,225,GUY Improved legislative framework for conducive environment in keeping with the growth and development  of the economy,Yes,1,GUY A comprehensive review of existing anti-corruption legislation 1.8.1.2: Conduct gap analysis and drafting of new bills [Bills/acts: Health Legislation (21 acts);  Anti-Corruption Bill; Rehabilitation of Offenders Bill; Sexual Harassment Bill; Domestic Violence (Amendment) Bill; Food Security Bill; Environmental Protection Bill; Land Zoning Bill; Solid Waste Management Bill; Bills implementing the HCCH Family Law Conventions and Apostille Convention; Juvenile Justice Regulations; Social Workers Licensing Bill; Code of Marketing for Breastmilk Substitute; Education Bill],64045,"OHCHR, PAHO/WHO, UNODC, UN Women, UNICEF, UNFPA, UNDP, FAO, UN Habitat",2021-01-01,2021-12-31,Finalisation,-,-,OHCHR,United Nations High Commissioner for Human Rights,United Nations High Commissioner for Human Rights,Ministry of Legal and Constitutional Affairs,16.3 Promote the rule of law at the national and international levels and ensure equal access to justice for all.,16 Peace and Justice - Strong Institutions,Curaçao; Curaçao; Guyana,Policy Advice and Thought Leadership,-,-,0 - Not expected to contribute to gender equality/women's empowerment,,0 - Not expected to contribute to realization of human rights,-,,-,-,-,-,,0,0,0.0,,,,-,,,,-,,,,-,,,,-,,,,-,,0.0,,-,,,,-,,,,-,,,,-,,,,-,,,,-,,,,-
the Caribbean,United Nations Sustainable Development Cooperation Framework,2,"Equality, Well-Being and Leaving No One Behind",4.0,"People in the Caribbean equitably access and utilize universal, quality and shock-responsive, social protection, education, health, and care services",21,"GUY Output 4.2 Improvements in quality of education for all children and youths supported [pre-primary, primary, secondary]",Yes,1,GUY SubOutput 4.2.1: Early Childhood Education-Early Childhood Development Access' - Ensure equitable and inclusive early childhood development and learning   ,88893,-,2022-01-01,2023-12-31,Finalisation,-,-,UNICEF,United Nations Children's Fund,United Nations Children's Fund,Guyana Ministry of Education,"4.1 By 2030, ensure that all girls and boys complete free, equitable and quality primary and secondary education leading to relevant and effective learning outcomes.",4 Quality Education,Guyana,Capacity Development/Technical Assistance,-,-,1 - Contributes to gender equality/women's empowerment in a limited way,,1 - Limited contribution to realization of human rights,-,,-,-,-,-,,569022,569030,569030.0,284511.0,216672.35,184958.59,-,284511.0,202187.52,154754.62,-,284511.0,229090.05,163386.74,-,284511.0,212600.41,169990.34,-,284511.0,213547.07,163635.01,-,284511.0,263923.62,192619.79,-,296601.0,265055.06,189466.37,"UNICEF supported the expanding of the education programme focusing on the return to school and learning loss for all, including migrants and children with disabilities to complete their education and develop their talents and skills. ",272421.0,190633.9,132500.85,-,24661.49,16245.12,12533.61,-,10900.17,8610.16,6580.38,-,,,,-,,,,-
the Caribbean,United Nations Sustainable Development Cooperation Framework,4,"Peace, Safety, Justice, and the Rule of Law",8.0,"People in the Caribbean and communities actively contribute to and benefit from building and maintaining safer, fairer, more inclusive, and equitable societies",5,GUY  Output 8.1 Support provided to national institutions and civil society to promote social norms and culture of non-violence and community engagement for achievement of all development results,Yes,1,"GUY SubOutput 8.1.1: Support to the ""One Guyana"" initiative and associated Multi-stakeholder dialogue mechanisms: Support for the establishment of (i) civic / voter education programming; (ii) the One Guyana Commission and associated legislation; (iii) the Youth Advisory Council; (iii) the National Multi-Stakeholder Forum; (iv) a multi-stakeholder forum/group to review SDG progress. ",88972,-,2022-01-01,2023-12-31,Finalisation,-,-,UNDP,United Nations Development Programme,United Nations Development Programme,Guyana Ministry of Parliamentary Affairs and Governance,"4.7 By 2030, ensure that all learners acquire the knowledge and skills needed to promote sustainable development, including, among others, through education for sustainable development and sustainable lifestyles, human rights, gender equality, promotion of a culture of peace and nonviolence, global citizenship and appreciation of cultural diversity and of culture's contribution to sustainable development.",4 Quality Education,Guyana,Capacity Development/Technical Assistance; Support Functions; Convening/Partnerships/Knowledge Sharing,-,-,1 - Contributes to gender equality/women's empowerment in a limited way,,1 - Limited contribution to realization of human rights,-,,-,-,-,-,,0,0,0.0,,,,-,,,,-,,,,-,,,,-,,,,-,,,,-,,0.0,," The Strengthening Institutions and Capacities for Dialogue and Grievance Redress for Inclusive Nation-building project to be financed by the Peacebuilding Fund is expected to strengthen the capacities of at least 5 constitutional bodies, including the rights commissions. Implementation is expected to commence in 2023. Project document drafted. Government's feedback is currently beeing solicited. ",,0.0,,-,,,,-,,,,-,,,,-,,,,-
