the Caribbean,United Nations Sustainable Development Cooperation Framework,2,"Equality, Well-Being and Leaving No One Behind",4.0,"People in the Caribbean equitably access and utilize universal, quality and shock-responsive, social protection, education, health, and care services",308,MSDCF 4.3: National institutions strengthened to deliver shock-resilient education and learning,Yes,253,"JAM: Education system is strengthened to deliver resilient, equitable, inclusive, quality, and relevant education services with a focus on the most vulnerable (children with disabilities, children at risk of dropping out, out-of-school and those affected by emergencies)",91487,-,2022-03-01,2026-12-31,Implementation,-,-,UNICEF,United Nations Children's Fund,Core Funding; European Union; Spanish Committee for UNICEF; UNICEF Education Thematic Fund; UNICEF Private Sector Fundraising; UNICEF WASH Thematic Trust Fund,"Jamaica Jamaica Ministry of Education, Youth and Information; Jamaica Teaching Council","4.1 By 2030, ensure that all girls and boys complete free, equitable and quality primary and secondary education leading to relevant and effective learning outcomes.,4.5 By 2030, eliminate gender disparities in education and ensure equal access to all levels of education and vocational training for the vulnerable, including persons with disabilities, indigenous peoples and children in vulnerable situations.,6.2 By 2030, achieve access to adequate and equitable sanitation and hygiene for all and end open defecation, paying special attention to the needs of women and girls and those in vulnerable situations.",4 Quality Education; 6 Clean Water and Sanitation,Jamaica,Capacity Development/Technical Assistance; Direct Support/ Service Delivery,-,-,2 - Gender equality/women's empowerment is a significant objective,,2 - Significant contribution to realization of human rights,-,,0 - Not expected to contribute towards sustaining peace,,Children ; Youth,Donneth Edmondson,,2190470,1533579,849565.0,547617.5,411990.28,387197.83,-,547617.5,393639.44,309632.44,-,547617.5,425785.97,305479.73,-,547617.5,459593.99,378347.71,-,547617.5,416784.01,336498.55,-,547617.5,480598.19,352603.39,-,370000.0,288508.72,256885.67,-,486250.0,378704.93,283614.28,"Emphasizing learning recovery and resilience, the JCO continued) to fund the completion of the Ministry of Education and Youth’s Learning Passport (LP) Jamaica, Educational Management Information System (EMIS) and Accessible Digital Textbook (ADT) pilots reaching over 4000 educators, administrators, parents and students. Recognized as a featured learning recovery effort by the MOEY, the LP is well-positioned to grow to support mainstream learning through the secondary level, ongoing capacity development of teachers on remote learning and provide continuity during any future school closures. 932 lessons across 19 categories were developed and sector sensitizations were staged through webinars, workshops and social media activations including a summer series with playful, age-appropriate, culturally relevant, Foundational Literacy and Numeracy (FLN) content that garnered 500 views and directed students to the LP using a QR code. A FLN focused “Cornershop Challenge” poster was distributed to 100 locations island-wide in partnership with a telecommunication company’s foundation. That social media reel received 209,000 views. The EMIS pilot was completed in 20 schools potentially impacting 2000 students. 87 administrators participated in training on eight data points related to student and teacher attendance, behaviour, and student assessment.   Penetration tests were completed and the EMIS platform is preparing to go live aiming for full roll out within 2 years.The JCO made progress on inclusive content development with two of the targeted 12 accessible digital books reaching some 3777 users and the remaining ten slated for dissemination in 2024. Two ADT informational webinars were attended by some 700 teachers. Innocenti released its report on the pilot with specific recommendations for inclusive digital teaching and learning in the Jamaican context. Support to safer school environments continued to be prioritised. A total of 409 schools received trainings on implementing the student-centred School-wide Positive Behaviour Intervention and Support (SWPBIS) framework, potentially impacting some 250,000 students. Twenty master trainers completed PFA training to help create SWPBIS aligned communities of care in 2024. Thirty-one participants also completed the Spotlight Initiative funded Leadership for Safer School (LSS) programme, while, through the same funding source, 611 students with disabilities and 152 of their parents and teachers received GBV training.  100 school leaders completed Child Friendly Schools (CFS) training and 100 teachers completed the Jamaica Teaching Council’s second PFA-based Return to Happiness (RTH) course Together these initiatives support ongoing efforts towards improved mental health and psychosocial support sector-wide. Surveys of these course participants are underway to enable identification of best practices in how schools can prioritize children’s rights throughout 2024.The JCO  provided technical assistance to the finalization of a national character education training plan aligned with the SWPBIS scale-up, as well as the national Education Transformation Oversight Council and the National Violence Prevention Commission.  Finally, the school wellness survey, the Welbin Index, was disseminated to key stakeholders and to some 500 individual schools (accounting for almost 70% of all primary and secondary schools). Efforts were also made to involve youth in program design and implementation, referencing relevant U-Report polls and facilitating ongoing dialogue with JCO Youth Council members.",524000.0,400218.74,313184.0,"To support improved data-driven decision-making, leading to more student-centered and effective educational support, resource allocation and increased sector resilience, the national EMIS roll out started in 245 schools identified by the education ministry based on device and internet access. This represents the first phase of an SDG fund digital education focused joint programme that began implementation in September. In addition, 1100 principals were sensitized to the EMIS through the UNICEF developed EMIS behaviour change management strategy required to ensure buy in and encourage the onboarding of all primary and secondary schools between 2024-26. EMIS data collection started with Attendance and Behaviour modules along with the school census. A digital audit instrument, slated to become interoperable with the EMIS, was also completed with UNICEF support and staff members of the Technical and Vocational Unit were trained to facilitate the creation of a database of the physical resources available in the 15 technical and agricultural high schools to better determine where technical support and resources are most needed.  Data driven efforts to address sector inequity also included content creation. Ongoing promotion of the FLN focused Learning Passport (LP) platform (following successful completion of the pilot) and of the complete 12-book Accessible Digital Textbook (ADT) series as core components of the education ministry’s online summer school has led to over 8000 users since both went live in mid-2024. The ADTs are featured on the LP and the JCO developed “Summer Spark” online Instagram series and “Cornershop Challenge” poster which features a QR code linked to the LP was reprinted and distributed to 100 locations island-wide through a partnership with a local telecommunication company’s foundation. A UNICEF led workshop with publishers and Jamaica’s signing of the Marrakesh Treaty has also confirmed interest in developing guidelines for the incorporation of universal design for learning principles into the country’s textbook approval process.  Efforts to empower teachers to create safe, supportive, inclusive, and growth-oriented learning environments also continued, with 191 school leaders completing various CFS-focused programmes potentially impacting some 25,000 students, 50 more schools completing training related to the Schoolwide Positive Behaviour Intervention and Support (SWPBIS)/VAC framework pushing the number of schools using this methodology to close to 600 (60% of primary and secondary schools). MHPSS also emerged as a key element of instruction with the total of teachers and volunteers having completed aligned training in the PFA focused Return to Happiness (RTH) approach and socio-emotional learning, rising to over 1000. This includes 530 teachers from the regions most affected by Hurricane Beryl and members of the 63 Communities of Care teams who support Guidance Counsellors in SWPBIS scale up efforts island-wide. In addition, 15,000 students received copies of the “Be Prepared,” disaster preparedness and response activity guide following the July passage of Hurricane Beryl as part of in-school based PFA sessions in the 45 most affected schools. These also included the creation and distribution of PFA support kits. An online version of “Be Prepared” was also shared sector wide. 348 recreation kits remain positioned with the Office of Disaster Preparedness and Emergency Management (ODPEM). UNICEF continued to support Education in Emergency (EiE) efforts providing substantial technical and financial assistance to the finalization of the Safe Schools Policy. School-based emergency guidelines and disaster preparedness and response plans will form part of the EMIS in its phased rolled out.  ",810220.0,590089.69,471664.89,-,,,,-,,,,-
the Caribbean,United Nations Sustainable Development Cooperation Framework,4,"Peace, Safety, Justice, and the Rule of Law",7.0,"Regional and national laws, policies, systems, and institutions improve access to justice and promote peace, social cohesion, and security",315,"MSDCF 7.1: Institutional capacity strengthened to reduce gender-based violence, violence against women and children and/or abuse",Yes,26,"Justice for children: Improve justice system for children  in conflict with the law for a better integration in the society with the focus on  restorative justice system. Family engagement, train justice personal, MHPSS, Education and skills development etc.",150603,-,2024-01-01,2025-12-31,Implementation,-,-,UNICEF,United Nations Children's Fund,United Nations Children's Fund,Suriname Medical Mission; Suriname Ministry of Justice and Police,16.3 Promote the rule of law at the national and international levels and ensure equal access to justice for all.,16 Peace and Justice - Strong Institutions,Suriname,Capacity Development/Technical Assistance; Other (including coordination); Convening/Partnerships/Knowledge Sharing,-,-,2 - Gender equality/women's empowerment is a significant objective,,2 - Significant contribution to realization of human rights,-,,-,-,Children ; Women & Girls,-,,100000,20000,10000.0,50000.0,41841.93,39749.83,-,50000.0,38696.59,26393.57,-,50000.0,42525.9,28928.84,-,50000.0,44449.91,34354.92,-,50000.0,43135.97,33242.44,-,50000.0,39089.85,30557.85,-,50000.0,42472.45,37718.46,-,50000.0,46900.8,42567.5,-,50000.0,36179.07,30864.78," As a result of UNICEF’s support, consultations regarding ‘Access to Justice and effective remedies were conducted with 124 children including those with disabilities, from schools, childcare facilities, and (pre-)detention centers, which provided valuable insights into their lived experiences, concerns, and recommendations and also assessed the children’s ability to exercise their right to access justice and seek remedies for rights violations. Additionally, consultations were conducted with 34 key stakeholders, including government, NGOs, and the judiciary, resulting in critical insights that helped verify whether States Parties are taking the necessary legislative, administrative, and other measures to ensure children's right to access justice and effective remedies, thereby ensuring the full realization of their rights.",50000.0,44374.27,31955.74,-,,,,-,,,,-
Brazil,United Nations Development Assistance Framework,1,People:  An inclusive and equitable society with full rights for all,1.0,"Outcome 1: Strengthened social development throughout the country, with poverty reduction through access to quality public goods and services, particularly in the areas of education, health, welfare, food and nutritional security and decent work, equitably and with emphasis on gender, racial, ethnic and generational equality",1,"1.1 Public policies and institutional capacities strengthened in the areas of education, health, social assistance, food security and nutrition and decent work in order to address the needs of the most vulnerable groups and promote gender, race, ethnicity throughout the life course",Yes,26,UNESCO 914BRZ1138 - Contributing for the implementation of results-based management and governance of the national response to STD/AIDS and Viral Hepatitis among vulnerable populations focusing on access and quality of health education,70644,"The present project aims to contribute to the efficiency and effectiveness of results management, improving the governance of the national response to STD, AIDS and Viral Hepatitis, focusing on prevention and health education as well as on expanding access, research and quality of services to vulnerable population.",2021-01-01,2022-12-20,Implementation,-,-,UNESCO,"United Nations Educational, Scientific and Cultural Organisation",Brazilian Ministry of Health,Brazilian Ministry of Health,"3.3 By 2030, end the epidemics of AIDS, tuberculosis, malaria and neglected tropical diseases and combat hepatitis, water-borne diseases and other communicable diseases.,3.7 By 2030, ensure universal access to sexual and reproductive health-care services, including for family planning, information and education, and the integration of reproductive health into national strategies and programmes.,4.7 By 2030, ensure that all learners acquire the knowledge and skills needed to promote sustainable development, including, among others, through education for sustainable development and sustainable lifestyles, human rights, gender equality, promotion of a culture of peace and nonviolence, global citizenship and appreciation of cultural diversity and of culture's contribution to sustainable development.,4.a Build and upgrade education facilities that are child, disability and gender sensitive and provide safe, non-violent, inclusive and effective learning environments for all.,5.6 Ensure universal access to sexual and reproductive health and reproductive rights as agreed in accordance with the Programme of Action of the International Conference on Population and Development and the Beijing Platform for Action and the outcome documents of their review conferences.,16.a Strengthen relevant national institutions, including through international cooperation, for building capacity at all levels, in particular in developing countries, to prevent violence and combat terrorism and crime.",3 Good Health and Well-being; 4 Quality Education; 5 Gender Equality; 16 Peace and Justice - Strong Institutions,Brazil,Capacity Development/Technical Assistance,-,-,1 - Contributes to gender equality/women's empowerment in a limited way,,1 - Limited contribution to realization of human rights,-,,-,-,-,Adriel Amaral,,1414189,1527324,1378883.0,707094.5,591423.17,451056.83,-,707094.5,653227.92,481603.91,-,707094.5,515669.37,451948.71,-,707094.5,513480.33,327685.56,-,707094.5,487550.3,361258.13,-,990522.0,815204.14,587459.54,"The Project has been working on HIV prevention with the key population for HIV. The activities of this Project are always focused on gender equality and gender mainstream. The Project always seeks to guarantee access to condoms. However, other alternatives to HIV prevention strategies, such as combined prevention, as a focus on the most vulnerable populations, are always considered. Involvement with organized civil society is still a fundamental axis of project actions. New technologies are always designed to access these populations and to foster access to treatment and prevention. Besides, it ensures that evidence-based strategies are the driving axes of all project actions.
There were not many Project's actions during 2020 due to the Covid-19 pandemic. However, there is a forecast of continuity of preventive operations - remote and in face-to-face - with civil society for the second half.
In the second half of 2020, 35 civil society organizations were selected to support actions in the territory for HIV prevention, other STIs with COVID as the central axis. Actions are starting and are expected to last throughout 2021.
Besides, it is essential to highlight that this Project contributes to 40 C/5 and SDG achievement. As can be seen in the success of the expected outcomes and goals and objectives:
Major Program I, Expected Result: 6.
Goal 3: (3.3, 3.5, and 3.d) Through access to condoms and combined prevention strategies, especially for vulnerable and key populations for the epidemic.
Goal 4: (4.7, 4.a). Investing in lifelong education in partnerships with organized civil society and NGOs that invest in the education of people living with HIV/AIDS. Besides, the Project invests in distance education strategies and face-to-face training of young people as strategic alternatives for training young leaders for HIV.
Goal 10: (10.3 and 10.4). Promoting gender equity actions, implemented through sexual diversity, access to health services.",423667.0,370853.55,309694.75,"The Project's goal is to apply Result-based management and Governance in the implementation of the National Policy for STD/HIV/AIDS and Viral Hepatitis to enhance the efficiency and efficacy of Preventive Education Programs toward the most vulnerable population. The Brazilian Health Ministry is a UNESCO greater partner and has been working on HIV prevention with the most vulnerable populations: young people, men who have sex with men, transvestites, female sex workers, drug users. To do so, UBO and the Project have established strategies to reach the most vulnerable populations easily in the territory. This Project supported formal education programs, enhancing Program Health in School and Project Health and Prevention in School, from which we implement EDUCAIDS in Brazil. However, considering the political conservative scenario in the country, schools are just talking about prevention against specific groups. During 2020, there are almost no school opened. The public schools were opened util the middle of March, considering the sanitary emergency. Also, informal education activities will be developed in partnership with civil society organizations that work with society's most vulnerable segments.The Project managed to achieve the main proposed results:Developing eight distance education courses for health professionals, education professionals, organized civil society, and young people; These courses are being incorporated into the Ministry of Health's distance education platform to ensure greater access.Twenty NGOs were selected to work with HIV prevention and health promotion. Actions are focused on the most vulnerable populations and key populations for HIV.Exhibitions and debates on the combined prevention of HIV and syphilis were held.Investing in lifelong education in partnerships with organized civil society and with NGOs that invest in the education of people living with HIV / AIDS. Besides, the Project invests in distance education strategies and face-to-face training of young people as strategic alternatives for training young leaders for HIV.As part of the scope of the Project's objectives, it is to promote studies and research on epidemiological, behavioral, and effectiveness trends in STI / HIV / AIDS. The Project, in partnership with some publica universities such as University of São Paulo developed some studies related to these issues. It developed: a cascade of care with an estimate of those infected with HIV; epidemiological and assistance analyzes of HIV and AIDS; epidemiological analysis of viral hepatitis reports; analyzes related to notifications of pregnant women with HIV / AIDS; analyzes related to cases of congenital syphilis; analyzes similar to syphilis during pregnancy. The Project has provided Management with the development of actions that contribute to analyzing the dynamics of the HIV / AIDS epidemic in the state and the strengthening of Management's governance capacity.The production and systematization of technical-scientific information have become an essential strategy for reaching health professionals and contributing to public political processes.Women, including Lesbians, bisexuals, transvestites, and transsexuals, were the population group with the most data produced. Consequently, new strategies of action and professional training.Currently, the HIV epidemic affects more young people, so the focus of the project's actions was aimed at young people. Both research, interventions, and strategies considered young people, men who have sex with men and women in situations of social vulnerability and difficulty accessing education and health services.",707094.5,493530.3,375164.17,-,707094.5,619629.94,515143.14,-,707094.5,599309.71,499363.29,-,,,,-,,,,-
the Caribbean,United Nations Sustainable Development Cooperation Framework,3,Resilience to Climate Change and Sustainable Natural Resource Management,5.0,"Caribbean people, communities, and institutions enhance their adaptive capacity for inclusive, gender responsive DRM and climate change adaptation and mitigation",309,MSDCF 5.1: Strengthened institutional  capacity for gender-inclusive adaptation and disaster management,Yes,2.6.15,2.6.15 BDS Increasing the Resilience of the Education System to Climate Change Impacts in the Eastern Caribbean,92187,"The project “Increasing the Resilience of the Education System to Climate Change Impacts in the Eastern Caribbean” aims to advance climate-resilient sustainable development in both countries by enhancing the resilience of their respective educational systems to extreme climate events. This will be done through the three components:
Component 1: Strengthen the enabling environment for adaptation planning within the education sector at the national and regional level
Component 2: Strengthen the capacity of schools, businesses, communities and households to understand climate risks and adaptation options, and cope with socio-emotional impacts,
Component 3: Climate-proofing interventions implemented in select school buildings to improve resilience to, and recovery from, extreme climate events
Component 3: Climate-proofing interventions implemented in select school buildings to improve resilience to, and recovery from, extreme climate events""
",2022-01-01,2026-12-31,Implementation,-,-,UN-HABITAT,United Nations Human Settlement Programme,-,Organisation of Eastern Caribbean States,-,-,Saint Lucia; Antigua and Barbuda,Capacity Development/Technical Assistance; Policy Advice and Thought Leadership,-,-,-,-,-,-,-,-,-,-,-,,0,0,0.0,,,,-,,,,-,,,,-,,,,-,,,,-,,,,-,,,,-,,,,-,,,,-,,,,-,,,,-,,,,-
