Haiti,United Nations Sustainable Development Cooperation Framework,3,SERVICES SOCIAUX DE BASE ET APPUI AU CONTRAT SOCIAL,4.0,"La population, particulièrement les groupes vulnérables et marginalisés, a un meilleur accès à des services sociaux de base équitables, inclusifs et de qualité, avec une emphase sur le respect des droits humains, l'égalité de genre, et l'inclusion du handicap, en vue du renforcement du contrat social. ",4.1,"Produit 4.1. La planification, la mise en œuvre, la coordination et le suivi des politiques publiques et cadres normatifs promouvant un accès universel à la protection sociale et aux services sociaux de base sont renforcées.																												",Yes,4.1.13,Education: Renforcement du système et génération d'évidences y compris dans les situations d'urgence.,136707,"Ce projet est structuré autour de sept composantes clés :

Composante 1 : Appuyer le fonctionnement de la coordination des urgences au niveau national et décentralisé, afin d'assurer une réponse efficace face aux crises.

Composante 2 : Renforcer le système éducatif en appuyant la mise en place de normes et de structures de gouvernance en matière d'apprentissage précoce et pré-primaire.

Composante 3 : Soutenir la révision du curriculum du préscolaire en conformité avec le Cadre d'Orientation Curriculaire (CoC) et les standards d'apprentissage précoce, en veillant à l'amélioration des infrastructures et des matériels pédagogiques.

Composante 4 : Renforcer la qualité de la formation initiale et continue des enseignants pour les niveaux fondamentaux 1 et 2 dans les départements ciblés qui ne sont pas affectés par des urgences.

Composante 5 : Améliorer l'éducation bilingue de qualité et promouvoir l'enseignement sûr en créole, y compris le développement de matériel pédagogique en créole et l'initiative SBC pour valoriser cet enseignement.

Composante 6 : Appuyer l'évaluation des compétences en lecture et en écriture dans les zones non affectées par des urgences, afin d'assurer un suivi des acquis des élèves.

Composante 7 : Renforcer les capacités des communautés scolaires dans les zones accueillant des enfants, par le biais d'exercices de simulation liés à la gestion des risques de désastre (GRD). 

Ces composantes visent à renforcer le système éducatif, améliorer l'accès et la qualité de l'éducation, tout en préparant les communautés à faire face à d'éventuelles urgences.",2023-01-01,2025-12-31,Implementation,-,-,UNICEF,United Nations Children's Fund,Belgian National Committee for UNICEF; UNICEF Multi-Donor Mobilization; UNICEF Other Resources; United Nations Children's Fund,"Ministère de l’Education Nationale et de la Formation professionnelle, Haiti","4.2 By 2030, ensure that all girls and boys have access to quality early childhood development, care and pre-primary education so that they are ready for primary education.,4.3 By 2030, ensure equal access for all women and men to affordable and quality technical, vocational and tertiary education, including university.,4.4 By 2030, substantially increase the number of youth and adults who have relevant skills, including technical and vocational skills, for employment, decent jobs and entrepreneurship.,4.5 By 2030, eliminate gender disparities in education and ensure equal access to all levels of education and vocational training for the vulnerable, including persons with disabilities, indigenous peoples and children in vulnerable situations.,5.6 Ensure universal access to sexual and reproductive health and reproductive rights as agreed in accordance with the Programme of Action of the International Conference on Population and Development and the Beijing Platform for Action and the outcome documents of their review conferences.,5.a Undertake reforms to give women equal rights to economic resources, as well as access to ownership and control over land and other forms of property, financial services, inheritance and natural resources, in accordance with national laws.,8.6 By 2020, substantially reduce the proportion of youth not in employment, education or training.",4 Quality Education; 5 Gender Equality; 8 Decent Jobs and Economic Growth,Haiti,Policy Advice and Thought Leadership,-,-,2 - Gender equality/women's empowerment is a significant objective,,3 - Principal contribution is to the realization of human rights,-,,2 - Sustaining Peace is a significant objective,,-,Jean Ernst SAINT FLEUR,,23660000,191522,116522.0,7886666.666666667,5490072.46,4213396.76,-,7886666.666666667,6071796.58,5212911.92,-,7886666.666666667,5783967.52,4450527.06,-,7886666.666666667,5520961.26,3890907.47,-,7886666.666666667,6221136.95,5819744.64,-,7886666.666666667,6264164.01,4988538.86,-,7886666.666666667,6296776.02,5259938.73,-,11792500.0,9759772.93,8145260.17,"Pour renforcer la coordination au niveau central, le cluster éducation a été activé et l'UNICEF a soutenu l'organisation de réunions de cluster sur une base régulière en collaboration avec Save the children en tant que co-responsables. Au niveau départemental, nous pouvons mentionner l'existence de personnel de terrain de l'UNICEF dans le Sud et le déploiement régulier d'un spécialiste de l'éducation dans l'Artibonite, qui a permis d'appuyer les DDE dans la coordination entre les partenaires, la collecte d'informations sur les écoles et la planification d'activités en réponse aux urgences sectorielles.",11792500.0,9554938.45,7425101.13,"Au cours de l'annee 2024, dans le Grand Sud, l’UNICEF et l’ONG The Children en collaboration avec le MENFP, ont organisé une formation sur l'Éducation en Situations d'Urgence (ESU) au profit de 75 acteurs  en vue d’outiller les acteurs du secteur éducatif des compétences aidant à répondre aux besoins urgents et à garantir l'accès à l'éducation dans ces circonstances exceptionnelles.  Ces sessions ont permis d’aborder des thèmes clés en conformité avec les Normes Minimales pour l'Éducation en Situations d'Urgence (INEE), publiées par le Réseau Inter-agences pour l'Éducation en Situations d'Urgence.  En parallèles 2 tables sectorielles ont été animées dans le Sud-Est et dans le Sud pour amener les acteurs à prendre conscience de leurs responsabilités quotidiennes en matière d’ Education en situations d’urgence (ESU). Pour renforcer la coordination au niveau central, l’organisation d’une conférence nationale sur la petite enfance, organise en septembre 2024, en soutien au MENFP, marquant une avancée importante dans la promotion de l'éducation préscolaire.   ",75000.0,66136.0,54225.89,-,,,,-,,,,-
Haiti,United Nations Sustainable Development Cooperation Framework,3,SERVICES SOCIAUX DE BASE ET APPUI AU CONTRAT SOCIAL,4.0,"La population, particulièrement les groupes vulnérables et marginalisés, a un meilleur accès à des services sociaux de base équitables, inclusifs et de qualité, avec une emphase sur le respect des droits humains, l'égalité de genre, et l'inclusion du handicap, en vue du renforcement du contrat social. ",4.1,"Produit 4.1. La planification, la mise en œuvre, la coordination et le suivi des politiques publiques et cadres normatifs promouvant un accès universel à la protection sociale et aux services sociaux de base sont renforcées.																												",Yes,4.1.23,Reforme curriculaire du Ministère de l' Education Nationale ,136489,"Haïti a approuvé en 2020 un nouveau plan à l’horizon 2030, qui vise notamment à accroitre l’efficacité interne et externe du système éducatif, afin de mieux répondre aux besoins de développement socioéconomique du pays tout en contribuant au développement durable et inclusif. Il s’agit d’un Plan Décennal d’éducation et de formation 2020-2030 (PDEF), constitué de quatre grandes priorités visant à transformer le système éducatif haïtien en profondeur, afin de le rendre plus accessible, plus équitable et plus performant. Ces quatre grandes priorités sont les suivantes :
Transformer la gouvernance du système éducatif à tous les niveaux ;
Offrir un service efficace d’éducation continue de qualité à la portée de tous les citoyens/ennes ;
Assurer que les sortants du système aient acquis les compétences et valeurs pour contribuer au développement de l’État Haïtien et pour être des citoyens productifs, performants tant au niveau national qu’au niveau international ;
Assurer que les groupes les plus désavantagés soient les premiers bénéficiaires des efforts de l’État dans le domaine éducatif.
Le Bureau International d’Education (BIE) de l’UNESCO a été sollicité par la Banque Interaméricaine de Développement et le Bureau UNESCO à Haïti pour soutenir spécifiquement la mise en œuvre de l’Axe II, consacré à l’amélioration de la qualité du système en général, et des enseignements apprentissages en particulier. Le financement total est de 1.765.255 dollars des Etats-Unies.",2023-01-01,2024-12-31,Implementation,-,-,UNESCO,"United Nations Educational, Scientific and Cultural Organisation",International Development Bank,IBE-UNESCO,"4.1 By 2030, ensure that all girls and boys complete free, equitable and quality primary and secondary education leading to relevant and effective learning outcomes.,4.3 By 2030, ensure equal access for all women and men to affordable and quality technical, vocational and tertiary education, including university.,4.4 By 2030, substantially increase the number of youth and adults who have relevant skills, including technical and vocational skills, for employment, decent jobs and entrepreneurship.,4.5 By 2030, eliminate gender disparities in education and ensure equal access to all levels of education and vocational training for the vulnerable, including persons with disabilities, indigenous peoples and children in vulnerable situations.,4.7 By 2030, ensure that all learners acquire the knowledge and skills needed to promote sustainable development, including, among others, through education for sustainable development and sustainable lifestyles, human rights, gender equality, promotion of a culture of peace and nonviolence, global citizenship and appreciation of cultural diversity and of culture's contribution to sustainable development.,4.a Build and upgrade education facilities that are child, disability and gender sensitive and provide safe, non-violent, inclusive and effective learning environments for all.",4 Quality Education,Artibonite; Haiti; Nippes; Centre; Nord-Est; Nord; Nord-Ouest; GrandeAnse,Other (including coordination); Convening/Partnerships/Knowledge Sharing; Capacity Development/Technical Assistance,-,-,2 - Gender equality/women's empowerment is a significant objective,,2 - Significant contribution to realization of human rights,-,,1 - Contributes to sustaining peace empowerment in a limited way,,Children ; Other; Youth,vanessa ST VAL; vanessa ST VAL; Jerry Registe ,,6765255,1765255,0.0,3382627.5,2594379.92,2071584.77,-,3382627.5,2579204.64,1983389.3,-,3382627.5,2747577.38,2265484.37,-,3382627.5,1985331.83,1510508.88,-,3382627.5,2719657.7,2368868.94,-,3382627.5,2414749.94,1693318.1,-,3382627.5,2667221.53,2403322.71,-,1765255.0,1472570.62,1120411.31,"Durant la mise en oeuvre du projet au cours de la période de 2022- 2023, le Bureau International de l'Education (BIE) et UNESCO ont organisé une série d'ateliers sur la transformation du système éducatif haïtien, la feuille de route de la reforme curriculaire, les mécanismes de pilotage de la Réforme Curriculaire. Des ateliers ont également été organisé avec différentes directions du Ministère de l'éducation, et des organisations locale et internationale travaillant dans le secteur de l'education afin de réfléchir sur les implications curriculaires du Cadre d’Orientation Curriculaire (COC) par rapport au Multilinguisme basé sur la langue maternelle et aux Approches pédagogiques visant à développer les compétences des élèves.Ces ateliers ont permis, entre autre, de renforcer les compétences de 164 agents et 87 agentes curriculaires du MENFP et des différentes parties impliquées dans la chaîne curriculaire, en matière de diagnostic curriculaire et d’analyse documentaire, afin qu’ils accompagnent la réalisation par l’UNESCO-BIE dudit Rapport d’état et qu’ils garantissent l’alignement avec le COC et la pertinence des documents curriculaires qui seront développés ou révisés au cours du projet. Ils ont également permis de dégager un consensus autour du contenu de la feuille de route de la réforme curriculaire avec les cadres du MENFP et accroître l’appropriation des parties prenantes et permettre à 109 hommes et 86 femmes de travailler sur la feuille de toute de la reforme curriculaire et 166 hommes et 86 femmes de débattre sur les mécanismes de pilotage de la Réforme Curriculaire à Port-au-Prince.",5000000.0,3366814.92,2805996.72,-,3382627.5,2975631.36,2804825.94,-,,,,-,,,,-
the Caribbean,2017-2021 MSDF,4,Strategic Priority 4 - A Sustainable and Resilient Caribbean,1.0,"Outcome 4.1 - Policies and programmes for climate change adaptation, disaster risk reduction and universal access to clean and sustainable energy in place.",154,Output 4.1.27 - Strengthened national capacity to fast track response on recovery efforts for key sectors,Yes,4.1.27.2,4.1.27.2 - Resilient rehabilitation of Salisbury Educational Facility in Dominica post-Hurricane Maria,42139,This project will support the rehabilitation of the two buildings at the Salisbury Educational Facility that were severely damaged by Hurricane Maria and that have been prioritized by the Government of Dominica.,2018-11-08,2020-12-31,Implementation,-,-,UNDP,United Nations Development Programme,Government of India,"Dominica Ministry of Environment, Climate Resilience, Disaster Management and Urban Renewal",13.1 Strengthen resilience and adaptive capacity to climate-related hazards and natural disasters in all countries.,13 Climate Action,Curaçao; Curaçao; Dominica,Capacity Development/Technical Assistance,-,-,1 - Contributes to gender equality/women's empowerment in a limited way,-,-,-,-,-,-,-,-,,0,0,717306.37,,,,-,,,,-,,,,-,,,717306.37,-,,0.0,,-,,,,-,,,,-,,,,-,,,,-,,,,-,,,,-,,,,-
the Caribbean,2017-2021 MSDF,2,Strategic Priority 2 - A Healthy Caribbean,1.0,Outcome 2.1 - Universal access to quality health care services and systems improved.,216,GUY Protecting health services and systems during COVID19 [SERP],Yes,42,"GUY Assisted with the development and distribution of COVID-19 Information, Education and Communication materials ",63906,-,2021-01-01,2021-12-31,Finalisation,-,-,PAHO,The Pan American Health Organization,The Pan American Health Organization,"Bhutan Department of Public Health, Ministry of Health","3.b Support the research and development of vaccines and medicines for the communicable and non-communicable diseases that primarily affect developing countries, provide access to affordable essential medicines and vaccines, in accordance with the Doha Declaration on the TRIPS Agreement and Public Health, which affirms the right of developing countries to use to the full the provisions in the Agreement on TradeRelated Aspects of Intellectual Property Rights regarding flexibilities to protect public health, and, in particular, provide access to medicines for all.,3.d Strengthen the capacity of all countries, in particular developing countries, for early warning, risk reduction and management of national and global health risks.",3 Good Health and Well-being,Curaçao; Guyana,Support Functions,-,-,0 - Not expected to contribute to gender equality/women's empowerment,,0 - Not expected to contribute to realization of human rights,-,,-,-,-,-,,85000,50000,0.0,85000.0,56935.54,42222.95,-,85000.0,60454.38,37484.88,-,85000.0,76397.85,67396.42,-,85000.0,67073.45,53954.25,-,85000.0,63745.01,50514.48,-,85000.0,73454.47,52692.21,-,85000.0,73054.46,53618.19,-,85000.0,67982.23,58772.14,-,85000.0,67489.93,52622.81,-,85000.0,65625.28,61139.82,-,,,,-,,,,-
Brazil,United Nations Sustainable Development Cooperation Framework,2,2. Inclusão Social para o Desenvolvimento Sustentável,1.0,"2.1 Até 2027, o Brasil terá ampliado e fortalecido a proteção social e demais políticas públicas para serem mais intersetoriais, inclusivas, participativas e efetivas, baseadas em evidências, atentas a grupos e pessoas em situação de vulnerabilidade e orientadas, em todos os níveis de governo, ao respeito aos direitos humanos e à redução da pobreza, da fome e das desigualdades de grupos e pessoas em situação de vulnerabilidade e à promoção da igualdade de geração, gênero, raça e etnia e do desenvolvimento sustentável ambiental e socialmente.",4,"2.1.4 Capacidades de gestão de políticas públicas de saúde, soberania e segurança alimentar e nutricional fortalecidas, com foco na produção ambientalmente adequada, no acesso igualitário, na qualidade e na ação intersetorial, de forma inclusiva e protetiva para todas as pessoas, em especial as que estão em situação de vulnerabilidade, a partir das perspectivas de geração, gênero, raça e etnia e do respeito aos direitos humanos.",Yes,42,UNESCO 914BRZ1054 Education innovative technologies and digital communication for preventing STD/HIV/AIDS implemented in the city of São Paulo,135761,"The purpose of this Project is to access strategic partnerships to access populations that are more vulnerable to HIV through new prevention technologies. The project hopes to reduce discrimination, especially to transgender people, people living with HIV / AIDS and Men who have sex with men. Treatment education actions to reduce virus transmission will be intensified with the most vulnerable populations.",2023-01-01,2023-03-05,Closed,-,-,UNESCO,"United Nations Educational, Scientific and Cultural Organisation",#BR Municipal Government of São Paulo,#BR Municipal Government of São Paulo,"3.3 By 2030, end the epidemics of AIDS, tuberculosis, malaria and neglected tropical diseases and combat hepatitis, water-borne diseases and other communicable diseases.,3.7 By 2030, ensure universal access to sexual and reproductive health-care services, including for family planning, information and education, and the integration of reproductive health into national strategies and programmes.,4.7 By 2030, ensure that all learners acquire the knowledge and skills needed to promote sustainable development, including, among others, through education for sustainable development and sustainable lifestyles, human rights, gender equality, promotion of a culture of peace and nonviolence, global citizenship and appreciation of cultural diversity and of culture's contribution to sustainable development.,4.a Build and upgrade education facilities that are child, disability and gender sensitive and provide safe, non-violent, inclusive and effective learning environments for all.,5.6 Ensure universal access to sexual and reproductive health and reproductive rights as agreed in accordance with the Programme of Action of the International Conference on Population and Development and the Beijing Platform for Action and the outcome documents of their review conferences.,16.a Strengthen relevant national institutions, including through international cooperation, for building capacity at all levels, in particular in developing countries, to prevent violence and combat terrorism and crime.",3 Good Health and Well-being; 4 Quality Education; 5 Gender Equality; 16 Peace and Justice - Strong Institutions,São Paulo; São Paulo (SP); Brazil,Capacity Development/Technical Assistance; Data Collection and Analysis,-,-,1 - Contributes to gender equality/women's empowerment in a limited way,"The sub-output has limited consideration for Gender Equality and Women's Empowerment (GEWE). Although there are some planned activities targeting women in light of persistent gender inequalities, the contribution to GEWE is minor compared to the overall outcomes. Sex-disaggregated indicators are available for some activities, and the project adopts a gender-sensitive approach during its implementation phase, including the hiring of staff, consultants, and participants in activities where applicable.",1 - Limited contribution to realization of human rights,-,,0 - Not expected to contribute towards sustaining peace,,"LGBTI persons (sexual orientation and gender identity); Other; Persons affected by chronic/long-term health conditions (e.g., HIV/AIDS, leprosy, diabetes, autoimmune disease, etc.); Persons of African Descent ",Rodrigo Araujo,,33191,33191,33191.0,33191.0,25593.78,17377.46,-,33191.0,24138.45,20802.76,-,33191.0,27509.23,21498.26,-,33191.0,23274.57,20988.15,-,33191.0,23367.07,17570.76,-,33191.0,21594.11,16433.66,-,33191.0,25865.66,21159.04,-,33191.0,29255.84,23654.73,"  In 2023, UNESCO provided technical assistance to the city of São Paulo by developing studies to understand the dynamics of the HIV epidemic focused on a vulnerable population and the development of education, communication, and information strategies on health education and HIV prevention. Project evaluation was carried out. Additionally, 16 training sessions and workshops were held with organized civil society and health professionals on new strategies for preventing HIV and other STIs, and nearly 40 seminars and meetings on HIV studies in the municipality were held, involving the most significant teaching, research, and technology institutions. As a result, over 1,200 persons are expected to have benefited from the activities, and São Paulo City Hall received certification for the elimination of vertical transmission of HIV. ",33191.0,29982.77,23450.32,-,33191.0,26157.91,22325.54,-,,,,-,,,,-
Haiti,United Nations Sustainable Development Cooperation Framework,3,SERVICES SOCIAUX DE BASE ET APPUI AU CONTRAT SOCIAL,4.0,"La population, particulièrement les groupes vulnérables et marginalisés, a un meilleur accès à des services sociaux de base équitables, inclusifs et de qualité, avec une emphase sur le respect des droits humains, l'égalité de genre, et l'inclusion du handicap, en vue du renforcement du contrat social. ",4.2,"Produit 4.2. Le plaidoyer et la capacité des détenteurs d'obligation et titulaires de droits pour l’accès aux services de base et à la protection sociale, ciblant particulièrement les femmes et les filles marginalisées, sont accrus en vue de réduire les inégalités.																												",Yes,4.2.19,Education:Les détenteurs d'obligation et titulaires de droits pour l’accès aux services de base en education ont leur capacités renforcées pour réduire les inégalités.,136635,"Ce projet comprend deux principales composantes :

- La composante 1 vise à assurer un enseignement à plusieurs niveaux, aussi bien formel que non formel, ainsi que des parcours d'apprentissage alternatifs, y compris dans des espaces d'apprentissage temporaires.
- La composante 2 a pour objectif de renforcer les communautés scolaires, telles que les associations de parents d'élèves et les comités de gestion des écoles, dans les zones non affectées par les urgences.",2023-07-01,2025-12-31,Implementation,-,-,UNICEF,United Nations Children's Fund,Education Cannot Wait Fund; Embassy of Japan; Government of Norway; Government of the Republic of Korea; The World Bank; UNICEF Education Thematic Fund; UNICEF Multi-Donor Mobilization; UNICEF Other Resources; United Nations Children's Fund,"Ministère de l’Education Nationale et de la Formation professionnelle, Haiti","4.1 By 2030, ensure that all girls and boys complete free, equitable and quality primary and secondary education leading to relevant and effective learning outcomes.,4.3 By 2030, ensure equal access for all women and men to affordable and quality technical, vocational and tertiary education, including university.,4.4 By 2030, substantially increase the number of youth and adults who have relevant skills, including technical and vocational skills, for employment, decent jobs and entrepreneurship.,4.5 By 2030, eliminate gender disparities in education and ensure equal access to all levels of education and vocational training for the vulnerable, including persons with disabilities, indigenous peoples and children in vulnerable situations.,4.a Build and upgrade education facilities that are child, disability and gender sensitive and provide safe, non-violent, inclusive and effective learning environments for all.,8.6 By 2020, substantially reduce the proportion of youth not in employment, education or training.,14.2 By 2020, sustainably manage and protect marine and coastal ecosystems to avoid significant adverse impacts, including by strengthening their resilience, and take action for their restoration in order to achieve healthy and productive oceans.",4 Quality Education; 8 Decent Jobs and Economic Growth; 14 Life Below Water,Haiti,Capacity Development/Technical Assistance,-,-,1 - Contributes to gender equality/women's empowerment in a limited way,,3 - Principal contribution is to the realization of human rights,-,,1 - Contributes to sustaining peace empowerment in a limited way,,Migrants; Youth; Women & Girls; Children ,Jean Ernst SAINT FLEUR,,4143070,1195588,695588.0,1381023.3333333333,901213.88,627644.11,-,1381023.3333333333,954418.96,802880.91,-,1381023.3333333333,1029121.44,749468.86,-,1381023.3333333333,1017187.18,722278.42,-,1381023.3333333333,1057492.46,872766.37,-,1381023.3333333333,987754.13,673688.41,-,1381023.3333333333,1100382.21,933452.55,-,1821535.0,1423001.15,1180189.24,-,1821535.0,1204531.81,985603.01,"durant l'annee 2024, avec l'appui de l'Unicef, 324 enseignants, moniteurs et parents ont pu beneficier des activites d’appui psychosocial et 2995 parents d'enfants ont pu beneficier de transferts moneatires en soutien au maintien des enfants a L'Ecole",500000.0,399106.91,371822.17,-,,,,-,,,,-
