Country,Plan name,Strategic priority,Outcome,Output,Sub-Output,SDG Targets,SDG Goals,QCPR function,Total required resources,Total available resources,Total expenditure resources,2018 Required,2018 Available,2018 Expenditure,2019 Required,2019 Available,2019 Expenditure,2020 Required,2020 Available,2020 Expenditure,2021 Required,2021 Available,2021 Expenditure,2022 Required,2022 Available,2022 Expenditure,2023 Required,2023 Available,2023 Expenditure,2024 Required,2024 Available,2024 Expenditure,2025 Required,2025 Available,2025 Expenditure,2026 Required,2026 Available,2026 Expenditure,2027 Required,2027 Available,2027 Expenditure
Sri Lanka,UNSDF 2018 - 2022,Driver 3: Human security and socio-economic resilience,"By 2022, people in Sri Lanka, especially the vulnerable and marginalised groups of children, youth, women, migrants, elderly and disabled, benefit equitably from dynamic and responsive social protection systems.",Health,Supporting Genomic sequencing of the SARS COV-2 virus to determine the major strain/s of the virus responsible for the pandemic at different    stages.,"3.d Strengthen the capacity of all countries, in particular developing countries, for early warning, risk reduction and management of national and global health risks.",3 Good Health and Well-being,-,1475410.5,100000.0,225000.0,50000.0,34960.7,22025.03,50000.0,36127.91,29566.38,50000.0,34955.93,27957.65,50000.0,39112.08,30453.35,112500.0,80365.88,51778.35,50000.0,30770.85,20499.35,50000.0,42482.5,28150.68,50000.0,45938.55,32000.12,50000.0,32874.14,22464.27,50000.0,33876.83,30542.35
Bhutan,United Nations Sustainable Development Cooperation Framework,Data and Policy," Outcome 1: By 2023, there is enhanced access to and use of reliable and timely data for inclusive and evidence-based policy and decision-making  ","1.1 - Central agencies and local governments are better able to integrate, monitor and report on Five-Year Plans and the SDGs","Develop training materials/manuals on data collection methods, standards and quality control aspects, responsibilities and accountability, and management of the NSDS at different levels",-,-,-,151628.0,151628.0,110538.5,,,,,,,,,,,,,,,,,,,,,,,,,,,,,,
Philippines,UN Socioeconomic and Peacebuilding Framework for COVID-19 Recovery in the Philippines 2020-2023,Prosperity and Planet,"Urbanization, economic growth, and climate change actions are converging for a resilient, equitable, and sustainable development path for communities.",Output 6: Resilience strengthened in all sectors and all levels of government,Strengthened trade facilitation capacity to implement the Customs Modernisation and Tariffs Act (CMTA) and WTO Trade Facilitation Agreement (WTO TFA)	,"8.1 Sustain per capita economic growth in accordance with national circumstances and, in particular, at least 7 per cent gross domestic product growth per annum in the least developed countries.",8 Decent Jobs and Economic Growth,Capacity Development/Technical Assistance,670806.0,670806.0,484872.0,223602.0,155151.09,110532.81,223602.0,149213.27,97277.33,223602.0,138820.53,129938.19,223602.0,183567.48,155310.38,223602.0,151887.53,103503.27,223602.0,187308.26,117776.68,223602.0,135482.04,88866.67,223602.0,151714.06,134356.73,223602.0,139397.12,86872.18,223602.0,180485.28,154120.9
Viet Nam,Viet Nam One Strategic Plan 2017-2021 (OSP),FOCUS AREA 1: INVESTING IN PEOPLE,"Outcome 1.2 - Equity in Health: By 2021, all people, particularly the most vulnerable, benefit from inclusive and equitable health systems, services and the promotion of healthy environments.","Output 1.2.1 - (RG1) Multi-sectoral policy dialogues and actions facilitated, to support the development and implementation of evidence-based and innovative strategies, policies and programmes that will address inequities in health.","1.2.1.24 - Support multi-sectoral collaboration and political commitment, raising awareness, and communications at different levels to tackled AMR","3.d Strengthen the capacity of all countries, in particular developing countries, for early warning, risk reduction and management of national and global health risks.",3 Good Health and Well-being,"Capacity Development/Technical Assistance, Policy Advice and Thought Leadership",313681.25,209008.32,112665.0,157268.25,124507.61,108424.46,157268.25,110493.24,67537.78,78206.5,49932.8,31140.58,78206.5,56413.6,40371.25,120359.0,113717.77,101478.59,120359.0,95596.7,62256.8,120359.0,88096.29,56145.21,120359.0,113549.93,94366.36,120359.0,72795.71,49294.78,120359.0,75579.3,65615.36
Pakistan,UNSDCF 2023 - 2027,Basic Social Services,"Outcome 1: By 2027, the people in Pakistan, especially the most vulnerable and deprived, have increased equitable access to and utilization of quality, sustainable basic social services (BSS).","Output 1.4: The education system in Pakistan has improved capacities to deliver more inclusive, equitable, gender-responsive, quality education and skills development, including lifelong learning opportunities and transferable skills, to children and youth, particularly girls and those residing in disadvantaged areas, including during humanitarian and emergency situations.",Improving quality and access to primary and secondary education through different learning modalities with integrated and cross sector service provision models.,"4.1 By 2030, ensure that all girls and boys complete free, equitable and quality primary and secondary education leading to relevant and effective learning outcomes.",4 Quality Education,"Capacity Development/Technical Assistance, Direct Support/ Service Delivery",3918290.0,3918290.0,3597587.0,3093687.0,2284674.7,2126266.59,3093687.0,2661183.41,1837681.43,3093687.0,1903974.26,1427114.71,3093687.0,2148260.71,1701629.35,3093687.0,1872738.06,1527953.51,3093687.0,2068102.57,1525385.43,824603.0,551814.17,478764.57,503900.0,412534.7,293642.53,503900.0,422208.45,300053.15,503900.0,357151.93,314947.75
India,United Nations Sustainable Development Cooperation Framework 2023-2027,PEOPLE: A society that empowers its marginalised populations and provides sustained access to quality services,"Health and well-being: By 2027, communities, especially the most disadvantaged, demand for and benefit from an inclusive, universal, affordable, accessible, accountable, and quality health care services, while adopting positive health practices",Sustainable Health Financing & Business Models: Financing and sustainable business models around health are strengthened.,"Strengthen and evolve stronger and effective public private partnership models in different areas of public health, and health services","3.1 By 2030, reduce the global maternal mortality ratio to less than 70 per 100,000 live births.,3.2 By 2030, end preventable deaths of newborns and children under 5 years of age, with all countries aiming to reduce neonatal mortality to at least as low as 12 per 1,000 live births and under-5 mortality to at least as low as 25 per 1,000 live births.",3 Good Health and Well-being,Convening/Partnerships/Knowledge Sharing,2772773.0,2605543.0,413050.0,294000.0,261534.31,247066.4,294000.0,189184.13,159802.94,294000.0,186397.74,160418.91,294000.0,213460.02,168443.36,294000.0,202733.15,129046.12,294000.0,186774.93,123387.48,1971422.0,1714071.12,1518874.21,507351.0,308035.47,205499.47,507351.0,365270.9,236025.96,507351.0,394822.27,274841.71
China,UNSDCF 2021 - 2025,Strategic Priority 1 - People and Prosperity,"Outcome 2: People’s lives in China are improved further as headway is made in ensuring access to childcare, education, healthcare services, elderly care, housing and social assistance, and more people in China, including left-behind groups, benefit from equitable and high-quality public services and social protection systems as well as accelerated efforts to reduce gender inequality and other forms of social inequality throughout the life-course. ","Shared Output 1.4 and 2.6:  With UN analytical inputs and technical assistance, China is better able to deliver inclusive, adaptive and quality lifelong education, learning and skills development which is accessible to all and relevant for life and work in the context of a rapidly evolving economic and social transformation.","1.4.2 & 2.6.2 Assist national partners in identifying skills mismatches and future skill needs, and designing and implementing gender responsive quality apprenticeship schemes based on good practices from different provinces and other countries","8.5 By 2030, achieve full and productive employment and decent work for all women and men, including for young people and persons with disabilities, and equal pay for work of equal value.,8.6 By 2020, substantially reduce the proportion of youth not in employment, education or training.",8 Decent Jobs and Economic Growth,"Capacity Development/Technical Assistance, Policy Advice and Thought Leadership",1700000.0,50000.0,84576.5,200000.0,181334.21,147942.26,200000.0,179004.96,108648.22,200000.0,182921.19,126412.56,200000.0,148418.93,132516.88,1500000.0,1270439.88,820782.86,50000.0,36106.67,25830.14,50000.0,44720.22,33412.83,50000.0,40227.53,26267.0,50000.0,40070.74,28840.93,50000.0,46673.29,40501.77
Sri Lanka,UNSDF 2018 - 2022,Driver 2: Strengthened innovative public institutions and engagement toward a lasting peace,"By 2022, people in Sri Lanka, especially the marginalised and vulnerable, benefit from more rights-based, accountable, inclusive and effective public institutions, to enhance trust amongst communities and towards the State",Social Cohesion,Promote social cohesion and women’s economic empowerment including through the transfer of assets with particular attention to vulnerable groups from different ethnic and faith groups including female headed households and victims of violent extremism,"5.a Undertake reforms to give women equal rights to economic resources, as well as access to ownership and control over land and other forms of property, financial services, inheritance and natural resources, in accordance with national laws.",5 Gender Equality,-,601328.0,2557371.25,14800.0,200442.0,162251.33,104706.32,200442.0,136653.32,127201.19,200442.0,164376.59,101061.76,200443.0,125396.26,100351.33,200443.0,151396.46,124335.52,623614.4285714285,537708.44,336698.94,771492.5714285715,697153.38,546622.56,560129.2857142857,509349.38,339150.61,436106.0952380953,364894.72,313630.96,410323.7142857143,387751.86,282114.47
Cambodia,Cambodia United Development Assistance Framework 2019-2023,"Strategic Priority 1 - Women and men in Cambodia, in particular the marginalized and vulnerable, have their basic needs addressed equitably",Outcome 1.2 - Public and private sectors provide quality services and expanded coverage for marginalized and vulnerable populations in line with international standards and norms (including during emergencies),"Sustained elimination of new HIV infections through combination HIV prevention approaches, including new case detection, treatment coverage and retention ","Supporting optimization of new case detection through differentiated HIV testing, including scale up of HIV Self Testing; and HIV treatment","3.3 By 2030, end the epidemics of AIDS, tuberculosis, malaria and neglected tropical diseases and combat hepatitis, water-borne diseases and other communicable diseases.",3 Good Health and Well-being,Policy Advice and Thought Leadership,181330.0,148830.0,163864.6666666667,36100.0,30787.51,24940.11,36100.0,26527.69,24631.15,36100.0,26544.24,18648.12,36100.0,28933.01,21245.54,72114.0,57263.79,53952.24,73116.0,65889.05,58356.7,73116.0,55912.46,47608.77,73116.0,57230.57,44594.33,73116.0,58832.24,40983.97,73116.0,60483.52,49236.97
Cambodia,Cambodia United Development Assistance Framework 2019-2023,"Strategic Priority 2 - Women and men in Cambodia, in particular those marginalized and vulnerable, benefit from expanded opportunities for decent work and technological innovations","Outcome 2.3 - Social norms, laws, policies and institutions promote economic inclusion, especially of women, persons with disabilities, women and men living in remote areas and the extreme poor",Barriers to participation of marginalized groups reduced; stigma and discrimination reduced,"Support to strengthening responsive social protection:  - Assess the impact of government cash transfers on poor and vulnerable groups with a focus on the differential impacts on women using a longitudinal tracer study and financial diaries - technical assistance on the revisions of the IDPoor scoring mechanism which include vulnerability parameters such as gender, household burden and disability status  - Option for single registry using block chain","1.3 Implement nationally appropriate social protection systems and measures for all, including floors, and by 2030 achieve substantial coverage of the poor and the vulnerable.",1 No Poverty,Capacity Development/Technical Assistance,778890.0,778890.0,163864.6666666667,518890.0,403398.7,339924.08,518890.0,361134.15,244243.57,518890.0,352853.86,291334.93,518890.0,387796.24,341278.52,260000.0,227502.58,198147.39,260000.0,225705.24,159862.58,260000.0,175457.48,153757.62,260000.0,210959.05,150751.74,260000.0,202283.31,139206.47,260000.0,218567.66,134071.76
China,UNSDCF 2021 - 2025,Strategic Priority 1 - People and Prosperity,"Outcome 1: Relative poverty and multi-dimensional poverty are reduced, and more coordinated development leads to reduction in gaps between rural and urban areas and among regions, as more people in China, including left-behind groups, benefit from sustainable, innovation-driven and shared high-quality economic development, with enhanced access to economic opportunities arising through innovation, entrepreneurship and rural revitalization, enjoying decent work, sustainable livelihoods and the right to development, equally for both women and men.  ","Output 1.1: UN analytical inputs and technical assistance have helped to strengthen China’s capacity to implement policies that better incentivize and stimulate public and private innovation and investment to reduce skills mismatches, income inequality and the gap between urban and rural areas, and consolidate achievements in poverty alleviation.",1.1.1 Enhance capacity of tripartite constituents to effectively address working condition challenges in different forms of employment by gender-sensitive approach in line with International Labor Standards,"5.4 Recognize and value unpaid care and domestic work through the provision of public services, infrastructure and social protection policies and the promotion of shared responsibility within the household and the family as nationally appropriate.,8.8 Protect labour rights and promote safe and secure working environments for all workers, including migrant workers, in particular women migrants, and those in precarious employment.","5 Gender Equality, 8 Decent Jobs and Economic Growth",Policy Advice and Thought Leadership,130000.0,50000.0,84576.5,50000.0,37770.84,29587.82,50000.0,33746.9,21254.81,50000.0,32278.99,29091.4,50000.0,34911.79,31594.87,50000.0,36222.92,21840.19,50000.0,44400.43,29481.03,80000.0,60025.04,38689.34,35000.0,31700.79,23950.12,35000.0,32060.68,27836.2,35000.0,24573.56,22565.12
China,UNSDCF 2021 - 2025,Strategic Priority 1 - People and Prosperity,"Outcome 2: People’s lives in China are improved further as headway is made in ensuring access to childcare, education, healthcare services, elderly care, housing and social assistance, and more people in China, including left-behind groups, benefit from equitable and high-quality public services and social protection systems as well as accelerated efforts to reduce gender inequality and other forms of social inequality throughout the life-course. ","Output 2.4: UN analytical inputs and technical assistance have helped to strengthen China’s capacity to develop and implement evidence-based laws, policies and programmes to promote gender equality, and reduce domestic violence, social exclusion, and other forms of social inequality discrimination.", 2.4.2 Support relevant Chinese authorities in creating a legal and operational framework conducive to assist foreigners with different range of needs in China ,"10.7 Facilitate orderly, safe, regular and responsible migration and mobility of people, including through the implementation of planned and well-managed migration policies.",10 Reduced Inequalities,Capacity Development/Technical Assistance,1000000.0,1000000.0,84576.5,500000.0,369711.65,314654.12,500000.0,456875.65,430807.36,500000.0,416346.28,353376.95,500000.0,456860.08,378150.74,500000.0,428521.91,407055.63,500000.0,321771.61,198125.95,500000.0,320879.58,211048.07,500000.0,422526.88,347557.43,500000.0,386276.03,362292.15,500000.0,374168.51,350306.02
China,UNSDCF 2021 - 2025,Strategic Priority 2 - Planet,"Outcome 4: China accelerates its transition to a people-centred, inclusive, low carbon, and circular economy.  ","Shared Output 3.5 and 4.3: The public discourse and action on the impact of climate change, disasters, the importance of biodiversity conservation and sustainable production and consumption patterns is increased.","3.5.5 & 4.3.5 Raise public awareness on the contribution and leadership of women in biodiversity conservation and climate change through online campaign and foster policy actions for feminist climate justice by engaging with different stakeholders through high level events, such as IWD, Commission on the Status of Women (CSW)","1.4 By 2030, ensure that all men and women, in particular the poor and the vulnerable, have equal rights to economic resources, as well as access to basic services, ownership and control over land and other forms of property, inheritance, natural resources, appropriate new technology and financial services, including microfinance.,1.5 By 2030, build the resilience of the poor and those in vulnerable situations and reduce their exposure and vulnerability to climate-related extreme events and other economic, social and environmental shocks and disasters.,2.3 By 2030, double the agricultural productivity and incomes of small-scale food producers, in particular women, indigenous peoples, family farmers, pastoralists and fishers, including through secure and equal access to land, other productive resources and inputs, knowledge, financial services, markets and opportunities for value addition and nonfarm employment.,5.a Undertake reforms to give women equal rights to economic resources, as well as access to ownership and control over land and other forms of property, financial services, inheritance and natural resources, in accordance with national laws.,5.b Enhance the use of enabling technology, in particular information and communications technology, to promote the empowerment of women.,8.5 By 2030, achieve full and productive employment and decent work for all women and men, including for young people and persons with disabilities, and equal pay for work of equal value.,17.9 Enhance international support for implementing effective and targeted capacity-building in developing countries to support national plans to implement all the sustainable development goals, including through North-South, South-South and triangular cooperation.","1 No Poverty, 2 Zero Hunger, 5 Gender Equality, 8 Decent Jobs and Economic Growth, 17 Partnerships for the Goals",Convening/Partnerships/Knowledge Sharing,22000.0,22000.0,84576.5,20000.0,18136.28,16219.2,20000.0,18681.56,16779.96,20000.0,18547.41,17245.95,20000.0,17410.0,14181.0,20000.0,14841.15,14023.87,20000.0,18575.17,13147.58,2000.0,1823.4,1726.45,2000.0,1282.01,1048.59,2000.0,1582.73,1131.63,2000.0,1349.45,1280.76
China,UNSDCF 2021 - 2025,Strategic Priority 2 - Planet,"Outcome 4: China accelerates its transition to a people-centred, inclusive, low carbon, and circular economy.  ","Output 4.1: Innovative new models to reduce GHG/CO2/ODS emissions are available, including public-private partnership approaches to implement sustainable low-carbon practices, with UN programmes, analytical inputs and technical assistance.","4.1.1 Facilitate China's work on reduction of GHG/CO2/ODS through PPP innovative technologies at national and subnational levels of different industries including construction, refrigeration etc. ","13.1 Strengthen resilience and adaptive capacity to climate-related hazards and natural disasters in all countries.,13.2 Integrate climate change measures into national policies, strategies and planning.,13.a Implement the commitment undertaken by developed-country parties to the United Nations Framework Convention on Climate Change to a goal of mobilizing jointly $100 billion annually by 2020 from all sources to address the needs of developing countries in the context of meaningful mitigation actions and transparency on implementation and fully operationalize the Green Climate Fund through its capitalization as soon as possible.",13 Climate Action,"Normative Support, Convening/Partnerships/Knowledge Sharing",6000000.0,4500000.0,84576.5,3000000.0,2625326.54,1587864.95,3000000.0,2689232.3,2235773.72,3000000.0,2379234.94,1840059.7,3000000.0,2351522.07,2206520.67,3000000.0,1948793.52,1371520.58,3000000.0,2763498.77,1921777.8,3000000.0,2174822.49,1527269.85,1500000.0,1189118.91,1087462.83,1500000.0,950120.33,750890.53,1500000.0,1266229.98,1103820.41
Maldives,United Nations Sustainable Development Cooperation Framework 2022 - 2026,Strategic Priority 1: Shared prosperity and inclusive human development for all.,"Outcome 1: By 2026, youth, women and others at risk of being left behind, contribute to and benefit from inclusive, resilient, sustainable economic and human capital development, fostering innovation, entrepreneurship and decent work.","Output 1.1:  The Government has strengthened capacity to establish and implement policies and initiatives which promote a dynamic, diversified and sustainable economy that delivers prosperity and opportunities to all, particularly for women.","Enhanced government capacity to strengthen fiscal policy through technical studies on tax incidence analysis, providing insights into the impact of taxation on different income groups to support evidence-based policymaking.","8.1 Sustain per capita economic growth in accordance with national circumstances and, in particular, at least 7 per cent gross domestic product growth per annum in the least developed countries.",8 Decent Jobs and Economic Growth,Policy Advice and Thought Leadership,25000.0,25000.0,106482.0,25000.0,22978.95,15998.09,25000.0,22229.37,14958.58,25000.0,17934.59,15252.47,25000.0,17473.23,11426.67,25000.0,16493.86,12639.44,25000.0,22941.2,21022.75,25000.0,16914.25,15025.53,25000.0,22707.67,14824.34,25000.0,22528.65,20351.29,25000.0,18472.54,16947.68
Maldives,United Nations Sustainable Development Cooperation Framework 2022 - 2026,Strategic Priority 1: Shared prosperity and inclusive human development for all.,"Outcome 2: By 2026, people in the Maldives, especially the most vulnerable and marginalised benefit from increased access to and use of quality, equitable, inclusive and resilient social and protection services, and have enhanced relevant skills and live fulfilled lives with wellbeing and dignity.","Output 2.2:  The education system and other stakeholders at all levels have strengthened capacities to deliver inclusive, equitable, adaptive, safe and quality lifelong education, learning and skills development which is accessible to all and relevant for life and work.  ","Curriculum Design, Teaching, Learning, and Assessment across the Life-Cycle: A transformative, skills focused, gender responsive, curriculum that is digitally enabled for improved learning outcomes, inclusion, reduced inequalities, and preparation of all students for work and life. Teachers have relevant knowledge, skills, and tools to manage classes, deliver the national curriculum, including hybrid learning, mentorship programs and use of gender transformative and differentiated learning methods and Universal Design for Learning (UDL), and recognize those with complex learning profiles, and provide them individualized curriculum plans (ICPs).","4.1 By 2030, ensure that all girls and boys complete free, equitable and quality primary and secondary education leading to relevant and effective learning outcomes.,4.5 By 2030, eliminate gender disparities in education and ensure equal access to all levels of education and vocational training for the vulnerable, including persons with disabilities, indigenous peoples and children in vulnerable situations.,4.7 By 2030, ensure that all learners acquire the knowledge and skills needed to promote sustainable development, including, among others, through education for sustainable development and sustainable lifestyles, human rights, gender equality, promotion of a culture of peace and nonviolence, global citizenship and appreciation of cultural diversity and of culture's contribution to sustainable development.,4.c By 2030, substantially increase the supply of qualified teachers, including through international cooperation for teacher training in developing countries, especially least developed countries and small island developing States.",4 Quality Education,Capacity Development/Technical Assistance,226250.0,226250.0,106482.0,226250.0,206066.44,137845.84,226250.0,166467.83,137218.22,226250.0,178369.42,165260.39,226250.0,158515.25,129208.79,226250.0,198860.96,143027.08,226250.0,208893.6,161611.31,226250.0,152316.62,140653.97,226250.0,142218.44,99994.82,226250.0,183624.15,135460.16,226250.0,178943.84,150013.71
